{
  "schema_version": "1.0-receipt",
  "record_kind": "finite_unique_coverage_shard",
  "campaign_id": "HSC-2026-08-01-001",
  "universe_id_sha256": "bd2b291c0b98f0c8a80ac9d87ac54fd0fa3ec4974da5cab93d269c4caf9def52",
  "evaluation_id_sha256": "0a8dda2e6e54351530ef60f6d6bec642b2f66be36636f30fc0b8f03ae1c28f46",
  "shard_index": 0,
  "start_ordinal": 0,
  "end_ordinal_exclusive": 131072,
  "previous_receipt_file_sha256": null,
  "range_merkle_root_sha256": "2df0fb464ef1a043077bc51fc6354b8e6198f2ccbad6678ea8e9935ca9910201",
  "range_frontier": [
    {
      "height": 17,
      "leaf_count": 131072,
      "sha256": "2df0fb464ef1a043077bc51fc6354b8e6198f2ccbad6678ea8e9935ca9910201"
    }
  ],
  "first_leaf_sha256": "b87b25a5a19377f4a82138de3ca3a4f34d1f463bad95f91ef727e2bda9833e98",
  "last_leaf_sha256": "adc7de4716519541aac69533e74d04d52df3407e1b88a57ae92267a38b7dc72b",
  "aggregates": {
    "cold": 94880,
    "warm": 36192,
    "type_counts": {
      "ATTACK": 60000,
      "BARRIER": 71072
    },
    "mask_counts": {
      "0": 36192,
      "2": 3000,
      "4": 2688,
      "8": 6048,
      "12": 672,
      "16": 6048,
      "20": 672,
      "24": 1512,
      "28": 168,
      "32": 7200,
      "34": 1800,
      "36": 4800,
      "38": 1200,
      "72": 12000,
      "74": 3000,
      "104": 7200,
      "106": 1800,
      "108": 4800,
      "110": 1200,
      "130": 16746,
      "134": 1856,
      "138": 4192,
      "142": 464,
      "146": 4186,
      "150": 464,
      "154": 1048,
      "158": 116
    }
  },
  "physical_evaluations": 131072,
  "unique_evaluation_cells_added": 131072,
  "duplicate_evaluations": 0,
  "elapsed_ns": 377087700,
  "signatures_per_minute": 20855414,
  "harness": {
    "path": "scripts/hypothesis_space_campaign.py",
    "sha256": "9c21ac7afece151c7a043f873e0198a0e826198c6158e1fe66e7aa79c567a0b0",
    "resolution_rule": "The recorded SHA-256 must match the current path or the same path in reachable Git history."
  },
  "receipt_payload_sha256": "2d102df391bf1b5596e15db6e07a8a8f09789cc292fac473cdd95509fbc267e5"
}
