{
  "schema_version": "1.0-receipt",
  "record_kind": "finite_unique_coverage_shard",
  "campaign_id": "HSC-2026-08-01-001",
  "universe_id_sha256": "bd2b291c0b98f0c8a80ac9d87ac54fd0fa3ec4974da5cab93d269c4caf9def52",
  "evaluation_id_sha256": "0a8dda2e6e54351530ef60f6d6bec642b2f66be36636f30fc0b8f03ae1c28f46",
  "shard_index": 1,
  "start_ordinal": 131072,
  "end_ordinal_exclusive": 262144,
  "previous_receipt_file_sha256": "426abbbbdd26e4d2c81c1eb0fd5c8c28fbb9995984f397efcec81b412e19a83b",
  "range_merkle_root_sha256": "4d57b2b60278857f2a569c4638b13528bf68ef6e4af72d827949cf6254548cb6",
  "range_frontier": [
    {
      "height": 17,
      "leaf_count": 131072,
      "sha256": "4d57b2b60278857f2a569c4638b13528bf68ef6e4af72d827949cf6254548cb6"
    }
  ],
  "first_leaf_sha256": "330f50507d1c9b948171648fd33cfa292c5fa5f788fce9bd7fac3ecdf19e5256",
  "last_leaf_sha256": "dd88ece1ba644844428398cf5bc5c5a3f97e899f072ec9b13b6c3910a1b0abca",
  "aggregates": {
    "cold": 97584,
    "warm": 33488,
    "type_counts": {
      "ADJACENT": 22144,
      "ATTACK": 10000,
      "BARRIER": 88928,
      "ENABLING": 10000
    },
    "mask_counts": {
      "0": 33488,
      "2": 500,
      "4": 4352,
      "8": 7872,
      "12": 1088,
      "16": 7872,
      "20": 1088,
      "24": 1968,
      "28": 272,
      "31": 22144,
      "32": 1200,
      "34": 300,
      "36": 800,
      "38": 200,
      "72": 2000,
      "74": 500,
      "104": 1200,
      "106": 300,
      "108": 800,
      "110": 200,
      "130": 17814,
      "134": 1984,
      "138": 4448,
      "142": 496,
      "146": 4454,
      "150": 496,
      "154": 1112,
      "158": 124,
      "258": 1792,
      "262": 768,
      "266": 448,
      "270": 192,
      "274": 448,
      "278": 192,
      "282": 112,
      "286": 48,
      "512": 2304,
      "516": 256,
      "520": 576,
      "524": 64,
      "528": 576,
      "532": 64,
      "536": 144,
      "540": 16,
      "642": 2304,
      "646": 256,
      "650": 576,
      "654": 64,
      "658": 576,
      "662": 64,
      "666": 144,
      "670": 16
    }
  },
  "physical_evaluations": 131072,
  "unique_evaluation_cells_added": 131072,
  "duplicate_evaluations": 0,
  "elapsed_ns": 377064300,
  "signatures_per_minute": 20856708,
  "harness": {
    "path": "scripts/hypothesis_space_campaign.py",
    "sha256": "9c21ac7afece151c7a043f873e0198a0e826198c6158e1fe66e7aa79c567a0b0",
    "resolution_rule": "The recorded SHA-256 must match the current path or the same path in reachable Git history."
  },
  "receipt_payload_sha256": "21e987ebe8d72ec01a418d72b8fa4e6122c31ebb68739f7783ad4134d54e5167"
}
